{
  "schemaVersion": 1,
  "id": "louisiana-synthetic-preview",
  "title": "Louisiana wetlands · synthetic preview",
  "provenance": {
    "kind": "synthetic",
    "description": "Deterministic schematic 20 × 20 power field. Synthetic days and cells do not represent Louisiana measurements or NISAR acquisitions. Spatial quartiles describe pixel spread, not confidence.",
    "generatorVersion": "0.1.0",
    "seed": 20261026,
    "productIds": []
  },
  "units": "gamma0_db",
  "polarization": "HH",
  "grid": {
    "width": 20,
    "height": 20,
    "order": "row-major",
    "coordinateSystem": "synthetic",
    "roiMask": [
      false,
      false,
      true,
      true,
      true,
      true,
      true,
      true,
      true,
      true,
      true,
      true,
      true,
      true,
      true,
      true,
      true,
      true,
      false,
      false,
      false,
      true,
      true,
      true,
      true,
      true,
      true,
      true,
      true,
      true,
      true,
      true,
      true,
      true,
      true,
      true,
      true,
      true,
      true,
      false,
      true,
      true,
      true,
      true,
      true,
      true,
      true,
      true,
      true,
      true,
      true,
      true,
      true,
      true,
      true,
      true,
      true,
      true,
      true,
      true,
      true,
      true,
      true,
      true,
      true,
      true,
      true,
      true,
      true,
      true,
      true,
      true,
      true,
      true,
      true,
      true,
      true,
      true,
      true,
      true,
      true,
      true,
      true,
      true,
      true,
      true,
      true,
      true,
      true,
      true,
      true,
      true,
      true,
      true,
      true,
      true,
      true,
      true,
      true,
      true,
      true,
      true,
      true,
      true,
      true,
      true,
      true,
      true,
      true,
      true,
      true,
      true,
      true,
      true,
      true,
      true,
      true,
      true,
      true,
      true,
      true,
      true,
      true,
      true,
      true,
      true,
      true,
      true,
      true,
      true,
      true,
      true,
      true,
      true,
      true,
      true,
      true,
      true,
      true,
      true,
      true,
      true,
      true,
      true,
      true,
      true,
      true,
      true,
      true,
      true,
      true,
      true,
      true,
      true,
      true,
      true,
      true,
      true,
      true,
      true,
      true,
      true,
      true,
      true,
      true,
      true,
      true,
      true,
      true,
      true,
      true,
      true,
      true,
      true,
      true,
      true,
      true,
      true,
      true,
      true,
      true,
      true,
      true,
      true,
      true,
      true,
      true,
      true,
      true,
      true,
      true,
      true,
      true,
      true,
      true,
      true,
      true,
      true,
      true,
      true,
      true,
      true,
      true,
      true,
      true,
      true,
      true,
      true,
      true,
      true,
      true,
      true,
      true,
      true,
      true,
      true,
      true,
      true,
      true,
      true,
      true,
      true,
      true,
      true,
      true,
      true,
      true,
      true,
      true,
      true,
      true,
      true,
      true,
      true,
      true,
      true,
      true,
      true,
      true,
      true,
      true,
      true,
      true,
      true,
      true,
      true,
      true,
      true,
      true,
      true,
      true,
      true,
      true,
      true,
      true,
      true,
      true,
      true,
      true,
      true,
      true,
      true,
      true,
      true,
      true,
      true,
      true,
      true,
      true,
      true,
      true,
      true,
      true,
      true,
      true,
      true,
      true,
      true,
      true,
      true,
      true,
      true,
      true,
      true,
      true,
      true,
      true,
      true,
      true,
      true,
      true,
      true,
      true,
      true,
      true,
      true,
      true,
      true,
      true,
      true,
      true,
      true,
      true,
      true,
      true,
      true,
      true,
      true,
      true,
      true,
      true,
      true,
      true,
      true,
      true,
      true,
      true,
      true,
      true,
      true,
      true,
      true,
      true,
      true,
      true,
      true,
      true,
      true,
      true,
      true,
      true,
      true,
      true,
      true,
      true,
      true,
      true,
      true,
      true,
      true,
      true,
      true,
      true,
      true,
      true,
      true,
      true,
      true,
      true,
      true,
      true,
      true,
      true,
      true,
      true,
      true,
      true,
      true,
      true,
      true,
      false,
      true,
      true,
      true,
      true,
      true,
      true,
      true,
      true,
      true,
      true,
      true,
      true,
      true,
      true,
      true,
      true,
      true,
      true,
      false,
      false,
      false,
      true,
      true,
      true,
      true,
      true,
      true,
      true,
      true,
      true,
      true,
      true,
      true,
      true,
      true,
      true,
      true,
      false,
      false
    ]
  },
  "histogramEdgesDb": [
    -6.0,
    -5.25,
    -4.5,
    -3.75,
    -3.0,
    -2.25,
    -1.5,
    -0.75,
    0.0,
    0.75,
    1.5,
    2.25,
    3.0,
    3.75,
    4.5,
    5.25,
    6.0
  ],
  "acquisitions": [
    {
      "id": "preview-day-1",
      "day": 1,
      "availability": "available",
      "valuesDb": [
        null,
        null,
        -11.291051,
        -10.457072,
        null,
        -11.906657,
        null,
        -12.884499,
        -13.983826,
        -13.670449,
        null,
        null,
        -13.077857,
        null,
        -11.100154,
        -12.892089,
        -12.207448,
        -11.414738,
        null,
        null,
        null,
        -10.792147,
        -9.315204,
        -10.70255,
        -9.639764,
        -10.775546,
        -11.057847,
        -12.438333,
        -12.070098,
        null,
        -15.399683,
        null,
        -13.605057,
        -12.472533,
        -11.191763,
        -11.912162,
        -11.911452,
        -11.438592,
        -9.934881,
        null,
        -11.127168,
        null,
        -10.176481,
        -10.907058,
        -11.288249,
        -10.488379,
        -10.658143,
        -11.50469,
        -11.100528,
        -12.929725,
        -13.696032,
        -14.031777,
        -15.317469,
        -14.057801,
        -13.738944,
        -13.030562,
        -12.209365,
        -10.611032,
        -10.161167,
        -10.132673,
        -10.770633,
        -11.23093,
        -10.058766,
        -9.30043,
        -10.597838,
        -9.767563,
        -10.255419,
        -11.963836,
        -12.611943,
        -13.733262,
        -13.629704,
        -15.532265,
        -15.561764,
        -13.731197,
        -12.583046,
        -13.604648,
        -11.55954,
        -12.03862,
        -9.863671,
        -9.481918,
        -9.269048,
        null,
        -9.077543,
        -10.927755,
        null,
        -10.561047,
        -11.20425,
        -11.175329,
        -11.532262,
        -11.639275,
        -13.095555,
        -14.317059,
        -15.670462,
        -14.412304,
        -14.487166,
        -12.233173,
        -10.924262,
        -10.13047,
        -10.882673,
        null,
        -11.154665,
        -10.733439,
        -9.105354,
        -9.962454,
        null,
        -10.071301,
        -11.288377,
        -10.51076,
        null,
        -12.702749,
        -12.298531,
        null,
        -13.934736,
        -15.592081,
        null,
        -12.633088,
        null,
        -11.009651,
        null,
        -9.443419,
        -10.539373,
        -9.737348,
        -10.757348,
        -9.938929,
        -10.15299,
        null,
        -11.047604,
        -12.22561,
        null,
        -11.380784,
        -12.833146,
        null,
        -14.769043,
        null,
        -13.521817,
        -13.32529,
        -10.750497,
        null,
        -10.913385,
        -9.905903,
        null,
        -10.144053,
        -10.951251,
        null,
        -10.246844,
        -10.489321,
        -10.46905,
        -11.775536,
        -11.626909,
        -11.94006,
        -12.527177,
        null,
        -14.45703,
        -14.338853,
        -13.450704,
        -11.604091,
        -10.631476,
        -10.166223,
        -11.26857,
        -10.163116,
        -9.746686,
        -11.075037,
        -10.43689,
        -10.348409,
        -11.085874,
        -10.996206,
        -10.76958,
        -11.733132,
        -11.302942,
        -13.274004,
        -13.460721,
        -13.882756,
        -14.284462,
        -15.222743,
        -13.790641,
        -12.182598,
        -9.996312,
        -11.233073,
        -9.674807,
        -9.146163,
        -9.626547,
        -10.812385,
        -11.09116,
        -11.703167,
        -10.663719,
        -10.526522,
        -11.56115,
        null,
        -12.984934,
        -12.589687,
        -15.209123,
        -15.140569,
        null,
        null,
        -12.096628,
        -11.374957,
        -9.90243,
        -9.483,
        -11.341727,
        -10.225838,
        -10.512423,
        -9.994535,
        -9.850777,
        null,
        -10.943071,
        -11.882201,
        -11.573145,
        -12.66247,
        -12.189486,
        -13.614495,
        -15.511977,
        -13.923145,
        -13.034071,
        -11.509602,
        -12.230515,
        -10.313754,
        -9.841723,
        -11.200843,
        -10.117223,
        -9.460926,
        -10.159064,
        -11.051369,
        null,
        -12.123834,